{
  "schema_version": 1,
  "corpus_id": "conversion-quality-stage1-50-v1",
  "stage": "stage1",
  "candidate_limit": 18,
  "options": {
    "profile": "quality-stage1-default",
    "candidate_limit": 18,
      "options_sha256": "8bacb7b728d414cc3e71a4c9a4829b3b91b5896c0971c76a3f5dd45c9b7012b3",
      "config_sha256": "9ea95ff88400bc32b3578f4feb7004f1dc982c8d00a86144c063140a872df6c4",
    "learning": "disabled",
    "user_dictionary": "disabled",
    "reranker": "off"
  },
  "cases": [
    {
      "case_id": "cq-001",
      "category": "compound_homophone",
      "reading": "いまりせきちゅうです",
      "before_surface": "伊万里脊柱です",
      "before_segments": [
        "伊万里",
        "脊柱です"
      ],
      "expected_surface": "今離席中です",
      "expected_segments": [
        "今",
        "離席中です"
      ],
      "segment_assertion": "explicit",
      "assertion_scope": "candidate_observation",
      "notes": "The explicit slash boundary is part of the supplied target contract."
    },
    {
      "case_id": "cq-002",
      "category": "katakana_loanword",
      "reading": "えもちらかす",
      "before_surface": "絵も散らかす",
      "before_segments": [
        "絵も",
        "散らかす"
      ],
      "expected_surface": "エモ散らかす",
      "expected_segments": [
        "エモ散らかす"
      ],
      "segment_assertion": "surface_only",
      "assertion_scope": "candidate_observation",
      "notes": "Creative/slang expression; keep as a semantic challenge, not a context-free Top-1 rule."
    },
    {
      "case_id": "cq-003",
      "category": "katakana_loanword",
      "reading": "おーすとられーしあ",
      "before_surface": "オーストラレー市亜",
      "before_segments": [
        "オー",
        "ストラレー",
        "市",
        "亜"
      ],
      "expected_surface": "オーストラレーシア",
      "expected_segments": [
        "オーストラレーシア"
      ],
      "segment_assertion": "surface_only",
      "assertion_scope": "candidate_observation",
      "notes": "Variant spelling should be reviewed before any lexical change."
    },
    {
      "case_id": "cq-004",
      "category": "compound_homophone",
      "reading": "おくがいすいせん",
      "before_surface": "屋外推薦",
      "before_segments": [
        "屋外",
        "推薦"
      ],
      "expected_surface": "屋外水栓",
      "expected_segments": [
        "屋外",
        "水栓"
      ],
      "segment_assertion": "explicit",
      "assertion_scope": "candidate_observation"
    },
    {
      "case_id": "cq-005",
      "category": "katakana_loanword",
      "reading": "かわぶーつ",
      "before_surface": "川ブーツ",
      "before_segments": [
        "川",
        "ブーツ"
      ],
      "expected_surface": "革ブーツ",
      "expected_segments": [
        "革",
        "ブーツ"
      ],
      "segment_assertion": "explicit",
      "assertion_scope": "candidate_observation"
    },
    {
      "case_id": "cq-006",
      "category": "lexical_compound",
      "reading": "かんきつこう",
      "before_surface": "柑橘孔",
      "before_segments": [
        "柑橘",
        "孔"
      ],
      "expected_surface": "柑橘香",
      "expected_segments": [
        "柑橘香"
      ],
      "segment_assertion": "surface_only",
      "assertion_scope": "candidate_observation"
    },
    {
      "case_id": "cq-007",
      "category": "business_phrase",
      "reading": "きゅうしょくからふっき",
      "before_surface": "給食から復帰",
      "before_segments": [
        "給食から",
        "復帰"
      ],
      "expected_surface": "休職から復帰",
      "expected_segments": [
        "休職から",
        "復帰"
      ],
      "segment_assertion": "explicit",
      "assertion_scope": "candidate_observation"
    },
    {
      "case_id": "cq-008",
      "category": "lexical_compound",
      "reading": "きょうふうち",
      "before_surface": "恐怖うち",
      "before_segments": [
        "恐怖",
        "うち"
      ],
      "expected_surface": "強風地",
      "expected_segments": [
        "強風地"
      ],
      "segment_assertion": "surface_only",
      "assertion_scope": "candidate_observation"
    },
    {
      "case_id": "cq-009",
      "category": "legal_compound",
      "reading": "ぎせいほうじん",
      "before_surface": "犠牲法人",
      "before_segments": [
        "犠牲",
        "法人"
      ],
      "expected_surface": "擬制法人",
      "expected_segments": [
        "擬制",
        "法人"
      ],
      "segment_assertion": "explicit",
      "assertion_scope": "candidate_observation"
    },
    {
      "case_id": "cq-010",
      "category": "business_compound",
      "reading": "こしゃたいおう",
      "before_surface": "古社対応",
      "before_segments": [
        "古社",
        "対応"
      ],
      "expected_surface": "個社対応",
      "expected_segments": [
        "個社",
        "対応"
      ],
      "segment_assertion": "explicit",
      "assertion_scope": "candidate_observation"
    },
    {
      "case_id": "cq-011",
      "category": "food_compound",
      "reading": "こめこめん",
      "before_surface": "米湖面",
      "before_segments": [
        "米",
        "湖面"
      ],
      "expected_surface": "米粉麺",
      "expected_segments": [
        "米粉",
        "麺"
      ],
      "segment_assertion": "explicit",
      "assertion_scope": "candidate_observation"
    },
    {
      "case_id": "cq-012",
      "category": "business_compound",
      "reading": "さいむかた",
      "before_surface": "債務方",
      "before_segments": [
        "債務",
        "方"
      ],
      "expected_surface": "債務過多",
      "expected_segments": [
        "債務",
        "過多"
      ],
      "segment_assertion": "explicit",
      "assertion_scope": "candidate_observation"
    },
    {
      "case_id": "cq-013",
      "category": "katakana_loanword",
      "reading": "しゅうじんぼっくす",
      "before_surface": "囚人ボックス",
      "before_segments": [
        "囚人",
        "ボックス"
      ],
      "expected_surface": "集塵ボックス",
      "expected_segments": [
        "集塵",
        "ボックス"
      ],
      "segment_assertion": "explicit",
      "assertion_scope": "candidate_observation"
    },
    {
      "case_id": "cq-014",
      "category": "library_compound",
      "reading": "しゅうみつしょか",
      "before_surface": "周密初夏",
      "before_segments": [
        "周密",
        "初夏"
      ],
      "expected_surface": "集密書架",
      "expected_segments": [
        "集密",
        "書架"
      ],
      "segment_assertion": "explicit",
      "assertion_scope": "candidate_observation"
    },
    {
      "case_id": "cq-015",
      "category": "business_compound",
      "reading": "しゅうれいかいぎ",
      "before_surface": "秀麗会議",
      "before_segments": [
        "秀麗",
        "会議"
      ],
      "expected_surface": "週例会議",
      "expected_segments": [
        "週例",
        "会議"
      ],
      "segment_assertion": "explicit",
      "assertion_scope": "candidate_observation",
      "notes": "The explicit slash boundary is part of the supplied target contract."
    },
    {
      "case_id": "cq-016",
      "category": "lexical_compound",
      "reading": "しょうすうけつ",
      "before_surface": "少数血",
      "before_segments": [
        "少数",
        "血"
      ],
      "expected_surface": "少数決",
      "expected_segments": [
        "少数決"
      ],
      "segment_assertion": "surface_only",
      "assertion_scope": "candidate_observation"
    },
    {
      "case_id": "cq-017",
      "category": "weather_compound",
      "reading": "しょうせつちいき",
      "before_surface": "小説地域",
      "before_segments": [
        "小説",
        "地域"
      ],
      "expected_surface": "少雪地域",
      "expected_segments": [
        "少雪",
        "地域"
      ],
      "segment_assertion": "explicit",
      "assertion_scope": "candidate_observation"
    },
    {
      "case_id": "cq-018",
      "category": "compound_homophone",
      "reading": "しんちょうのこうてい",
      "before_surface": "身長の工程",
      "before_segments": [
        "身長の",
        "工程"
      ],
      "expected_surface": "身長の高低",
      "expected_segments": [
        "身長の",
        "高低"
      ],
      "segment_assertion": "explicit",
      "assertion_scope": "candidate_observation"
    },
    {
      "case_id": "cq-019",
      "category": "technical_abbreviation",
      "reading": "じこべこうしん",
      "before_surface": "事故部更新",
      "before_segments": [
        "事故",
        "部",
        "更新"
      ],
      "expected_surface": "自己ベ更新",
      "expected_segments": [
        "自己ベ",
        "更新"
      ],
      "segment_assertion": "explicit",
      "assertion_scope": "candidate_observation"
    },
    {
      "case_id": "cq-020",
      "category": "fixed_expression",
      "reading": "じりつじきょう",
      "before_surface": "自立自供",
      "before_segments": [
        "自立",
        "自供"
      ],
      "expected_surface": "自立自強",
      "expected_segments": [
        "自立",
        "自強"
      ],
      "segment_assertion": "explicit",
      "assertion_scope": "candidate_observation"
    },
    {
      "case_id": "cq-021",
      "category": "food_compound",
      "reading": "すたまねぎ",
      "before_surface": "巣タマネギ",
      "before_segments": [
        "巣",
        "タマネギ"
      ],
      "expected_surface": "酢玉ねぎ",
      "expected_segments": [
        "酢",
        "玉ねぎ"
      ],
      "segment_assertion": "explicit",
      "assertion_scope": "candidate_observation"
    },
    {
      "case_id": "cq-022",
      "category": "katakana_loanword",
      "reading": "すてーきばる",
      "before_surface": "ステーキ張る",
      "before_segments": [
        "ステーキ",
        "張る"
      ],
      "expected_surface": "ステーキバル",
      "expected_segments": [
        "ステーキ",
        "バル"
      ],
      "segment_assertion": "explicit",
      "assertion_scope": "candidate_observation"
    },
    {
      "case_id": "cq-023",
      "category": "lexical_compound",
      "reading": "せいこんしゃ",
      "before_surface": "成婚車",
      "before_segments": [
        "成婚",
        "車"
      ],
      "expected_surface": "成婚者",
      "expected_segments": [
        "成婚者"
      ],
      "segment_assertion": "surface_only",
      "assertion_scope": "candidate_observation"
    },
    {
      "case_id": "cq-024",
      "category": "technical_compound",
      "reading": "せいすうかい",
      "before_surface": "整数櫂",
      "before_segments": [